[
  {
    "id": "D01",
    "domain": "Authority and subject identity",
    "choice": "Extend the current handbook and registry roles; resolve logical capability to immutable repository ID, source path, release and consumers.",
    "scope": "All first-party components",
    "alternatives_considered": [
      "A new separate governance repository",
      "Newest README wins",
      "Names as stable IDs"
    ],
    "acceptance": "Unique authoritative writer and explicit supersession, no unresolved field silently promoted to fact.",
    "exception_contract": "Ambiguous authority blocks only affected writes; useful independent product work continues.",
    "evidence": [
      "G13",
      "G11",
      "G12",
      "U01"
    ],
    "authority_status": "proposed operationalization",
    "enforcement_status": "not_deployed",
    "mutation_authority": false
  },
  {
    "id": "D02",
    "domain": "Reuse and new code",
    "choice": "Prefer removal of unnecessary work, existing external/shared capabilities, owned upstream improvement and narrow adapters before new generic implementations.",
    "scope": "Libraries, services, tools, docs, patterns and schemas",
    "alternatives_considered": [
      "Use as-is",
      "Extend owner",
      "Upstream contribution",
      "Bounded fork",
      "Keep local domain logic"
    ],
    "acceptance": "Consumer contract and total ecosystem burden improve; actual installed/imported path uses selected provider.",
    "exception_contract": "New implementation is permitted with explicit missing capability and evidence against serious alternatives.",
    "evidence": [
      "G13",
      "U01"
    ],
    "authority_status": "proposed operationalization",
    "enforcement_status": "not_deployed",
    "mutation_authority": false
  },
  {
    "id": "D03",
    "domain": "JavaScript/TypeScript lint",
    "choice": "Oxlint is the primary first-party lint engine; map existing semantic rules and enable applicable type-aware coverage.",
    "scope": "Eligible JS/TS first-party profiles",
    "alternatives_considered": [
      "Full ESLint",
      "Biome",
      "Oxlint plus disjoint missing-rule runner"
    ],
    "acceptance": "Seed representative errors for every required rule family; no loss of framework/security/boundary coverage.",
    "exception_contract": "A residual rule runner owns named unmatched rules/files only, has an owner, removal trigger and review deadline.",
    "evidence": [
      "U01",
      "G04",
      "G06",
      "G07",
      "W02"
    ],
    "authority_status": "proposed operationalization",
    "enforcement_status": "not_deployed",
    "mutation_authority": false
  },
  {
    "id": "D04",
    "domain": "Formatting",
    "choice": "Oxfmt owns supported eligible source formats; route other formats/plugins through explicit disjoint selectors.",
    "scope": "JS/TS and supported text formats",
    "alternatives_considered": [
      "Prettier",
      "Biome",
      "Format-specific tools"
    ],
    "acceptance": "Determinism, idempotence, semantic preservation and representative plugin/language fixtures.",
    "exception_contract": "Unsupported syntax/plugin behavior is an explicit compatibility gap; never run competing formatters on the same file set.",
    "evidence": [
      "U01",
      "W03"
    ],
    "authority_status": "proposed operationalization",
    "enforcement_status": "not_deployed",
    "mutation_authority": false
  },
  {
    "id": "D05",
    "domain": "TypeScript compiler",
    "choice": "Qualified native TypeScript 7 release, identified by resolved package/version/binary provenance; tsc is a valid native command.",
    "scope": "Typecheck/build CLI where supported",
    "alternatives_considered": [
      "Pinned JS TypeScript",
      "Native preview tsgo",
      "Framework-specific typecheck adapters"
    ],
    "acceptance": "Every project canary fails independently; diagnostics, module resolution, declarations, build and framework behavior pass.",
    "exception_contract": "Keep a scoped compiler-API/framework adapter until replaced with proven parity; do not remove it merely because its name contains typescript.",
    "evidence": [
      "U01",
      "W01",
      "G02",
      "G04",
      "G05"
    ],
    "authority_status": "proposed operationalization",
    "enforcement_status": "not_deployed",
    "mutation_authority": false
  },
  {
    "id": "D06",
    "domain": "JS dependency manager",
    "choice": "Pinned Bun with frozen dependency resolution for eligible first-party workspaces.",
    "scope": "Install, lockfile and script entry-point ownership",
    "alternatives_considered": [
      "npm",
      "pnpm",
      "Yarn"
    ],
    "acceptance": "Clean-room install, lifecycle-script behavior, workspace resolution, package packing and deploy reproducibility.",
    "exception_contract": "Upstream fork install contracts can be retained temporarily with exact boundary and migration proof.",
    "evidence": [
      "U01",
      "G02",
      "G06",
      "W07"
    ],
    "authority_status": "proposed operationalization",
    "enforcement_status": "not_deployed",
    "mutation_authority": false
  },
  {
    "id": "D07",
    "domain": "JavaScript runtime and testing",
    "choice": "Prefer Bun independently of package-manager choice, after runtime and test-runner conformance.",
    "scope": "Owned services, CLIs and tests",
    "alternatives_considered": [
      "Node runtime",
      "Bun runtime",
      "Native module extraction"
    ],
    "acceptance": "Production API, native ABI, shutdown, streams, TLS, subprocess, snapshot/mocking and test selection parity.",
    "exception_contract": "Node-specific upstream/native behavior must have an owned exception or remediation; no blind executable substitution.",
    "evidence": [
      "U01",
      "G07",
      "W07"
    ],
    "authority_status": "proposed operationalization",
    "enforcement_status": "not_deployed",
    "mutation_authority": false
  },
  {
    "id": "D08",
    "domain": "Python management",
    "choice": "uv owns interpreter/environment/dependency resolution, with frozen locks for application profiles.",
    "scope": "Python first-party components",
    "alternatives_considered": [
      "pip/venv",
      "Poetry",
      "Conda for specific binary stacks"
    ],
    "acceptance": "Clean environment and explicit interpreter/dependency identities; supported platform matrix.",
    "exception_contract": "External binary distribution boundaries may require another tool, never a silently interchangeable environment.",
    "evidence": [
      "U01",
      "W04",
      "G09",
      "G10"
    ],
    "authority_status": "proposed operationalization",
    "enforcement_status": "not_deployed",
    "mutation_authority": false
  },
  {
    "id": "D09",
    "domain": "Python free threading",
    "choice": "Target CPython 3.14t for eligible owned execution profiles; verify supported build and actual GIL state after relevant imports.",
    "scope": "Runtime profiles, not package minimum metadata",
    "alternatives_considered": [
      "GIL-enabled CPython",
      "Processes",
      "Native hot path",
      "Different interpreter"
    ],
    "acceptance": "GIL state, native wheels, race tests, concurrency load and actual time/memory improve or satisfy accepted budgets.",
    "exception_contract": "Unsupported extension or unacceptable measured regression is explicit blocked/exception state, not automatic fallback or forced unsafe GIL disable.",
    "evidence": [
      "U01",
      "W05",
      "G09",
      "G10"
    ],
    "authority_status": "proposed operationalization",
    "enforcement_status": "not_deployed",
    "mutation_authority": false
  },
  {
    "id": "D10",
    "domain": "Python static analysis",
    "choice": "Ruff for lint/format; qualify ty as preferred fast type-checker for supported profiles while retaining indispensable scoped API/plugin coverage.",
    "scope": "Python owned source",
    "alternatives_considered": [
      "mypy",
      "Pyright",
      "ty"
    ],
    "acceptance": "Seed missing imports, bad types and framework contracts; intended syntax target matches policy.",
    "exception_contract": "Do not silently lose mypy plugin/stub behavior; exact remaining scope is recorded.",
    "evidence": [
      "G09",
      "G10"
    ],
    "authority_status": "recommended selection; type-checker promotion requires parity",
    "enforcement_status": "not_deployed",
    "mutation_authority": false
  },
  {
    "id": "D11",
    "domain": "Git hooks",
    "choice": "Lefthook is the single owned hook orchestrator; shared commands also run in mandatory CI.",
    "scope": "Active first-party development checkouts",
    "alternatives_considered": [
      "Husky",
      "pre-commit",
      "Handwritten hooks"
    ],
    "acceptance": "Installed hook path, effective config, nested/staged file selection, failure propagation and CI equivalence.",
    "exception_contract": "Unmodified upstream checkout can retain its hooks under a fork boundary; do not stack competing managers.",
    "evidence": [
      "U01",
      "G14",
      "W08",
      "W24"
    ],
    "authority_status": "proposed operationalization",
    "enforcement_status": "not_deployed",
    "mutation_authority": false
  },
  {
    "id": "D12",
    "domain": "MCP",
    "choice": "Use maintained FastMCP for Python servers; PhenoFast is a thin shared integration policy layer only where it adds nonduplicated value.",
    "scope": "MCP framework, auth/telemetry integration and service bindings",
    "alternatives_considered": [
      "Raw protocol implementation",
      "Official native-language SDK",
      "Qualified same-team TS FastMCP counterpart"
    ],
    "acceptance": "Transport/schema/authorization/cancellation/error/shutdown/consumer conformance; no import-success stub counted as service.",